{
  "slug": "monochrome",
  "name": "Monochrome",
  "surfaces": ["marketing"],
  "description": "One hue with strict tonal steps and restrained detail.",
  "bestFor": ["luxury", "portfolios"],
  "typePair": {
    "display": "IBM Plex Sans, system-ui, sans-serif",
    "body": "IBM Plex Sans, system-ui, sans-serif"
  },
  "typeScale": { "base": 16, "ratio": 1.25, "steps": [12, 14, 16, 20, 25, 31] },
  "radius": { "control": "4px", "panel": "8px" },
  "border": "1px solid",
  "shadow": "none",
  "colorRecipe": {
    "background": "#FAFAFA",
    "surface": "#EEEEEE",
    "text": "#111111",
    "mutedText": "#4A4A4A",
    "accent": "#1F2937",
    "accentText": "#FFFFFF",
    "border": "#A3A3A3",
    "focus": "#111111",
    "contrastPairs": [
      {
        "foreground": "#111111",
        "background": "#FAFAFA",
        "ratio": 18.09,
        "usage": "text on background"
      },
      {
        "foreground": "#4A4A4A",
        "background": "#FAFAFA",
        "ratio": 8.49,
        "usage": "muted text on background"
      },
      {
        "foreground": "#111111",
        "background": "#EEEEEE",
        "ratio": 16.28,
        "usage": "text on surface"
      },
      {
        "foreground": "#4A4A4A",
        "background": "#EEEEEE",
        "ratio": 7.64,
        "usage": "muted text on surface"
      },
      {
        "foreground": "#FFFFFF",
        "background": "#1F2937",
        "ratio": 14.68,
        "usage": "accent text on accent"
      },
      {
        "foreground": "#1F2937",
        "background": "#FAFAFA",
        "ratio": 14.06,
        "usage": "accent text on background"
      },
      {
        "foreground": "#111111",
        "background": "#FAFAFA",
        "ratio": 18.09,
        "usage": "focus ring on background"
      }
    ]
  },
  "density": 4,
  "motion": 1,
  "layoutRules": [
    "Use tonal steps instead of extra hues.",
    "Reserve the darkest value for primary actions and headings.",
    "Keep borders and dividers consistent."
  ],
  "do": ["Pair every status with text or an icon.", "Use weight and spacing for hierarchy."],
  "dont": ["Use tone alone to signal success or error.", "Flatten hover and focus states."],
  "a11yRisk": "Removing color can leave status and validation cues ambiguous unless icons and labels carry the meaning."
}
