{
  "slug": "bauhaus",
  "name": "Bauhaus",
  "surfaces": ["marketing"],
  "description": "Primary shapes, geometric type and disciplined color.",
  "bestFor": ["design studios", "events"],
  "typePair": {
    "display": "Futura, Avenir Next, sans-serif",
    "body": "Work Sans, system-ui, sans-serif"
  },
  "typeScale": { "base": 16, "ratio": 1.333, "steps": [12, 14, 16, 21, 28, 37] },
  "radius": { "control": "0px", "panel": "0px" },
  "border": "2px solid",
  "shadow": "none",
  "colorRecipe": {
    "background": "#FFF9E8",
    "surface": "#F4EACB",
    "text": "#15120B",
    "mutedText": "#554C34",
    "accent": "#B91C1C",
    "accentText": "#FFFFFF",
    "border": "#D4C79F",
    "focus": "#B91C1C",
    "contrastPairs": [
      {
        "foreground": "#15120B",
        "background": "#FFF9E8",
        "ratio": 17.78,
        "usage": "text on background"
      },
      {
        "foreground": "#554C34",
        "background": "#FFF9E8",
        "ratio": 8.09,
        "usage": "muted text on background"
      },
      {
        "foreground": "#15120B",
        "background": "#F4EACB",
        "ratio": 15.56,
        "usage": "text on surface"
      },
      {
        "foreground": "#554C34",
        "background": "#F4EACB",
        "ratio": 7.08,
        "usage": "muted text on surface"
      },
      {
        "foreground": "#FFFFFF",
        "background": "#B91C1C",
        "ratio": 6.47,
        "usage": "accent text on accent"
      },
      {
        "foreground": "#B91C1C",
        "background": "#FFF9E8",
        "ratio": 6.15,
        "usage": "accent text on background"
      },
      {
        "foreground": "#B91C1C",
        "background": "#FFF9E8",
        "ratio": 6.15,
        "usage": "focus ring on background"
      }
    ]
  },
  "density": 4,
  "motion": 2,
  "layoutRules": [
    "Build from circles, squares and triangles on one grid.",
    "Use one primary color plus black and paper per section.",
    "Align every shape edge to the grid."
  ],
  "do": ["Pair color with shape and text.", "Keep type geometric and highly legible."],
  "dont": ["Use shapes as decoration without hierarchy.", "Let primary colors cover body text."],
  "a11yRisk": "Shape and color can carry too much meaning, and large saturated fields can hide weak text contrast."
}
