{
  "slug": "organic-blob",
  "name": "Organic / Blob",
  "surfaces": ["marketing"],
  "description": "Rounded shapes and warm curves with a human rhythm.",
  "bestFor": ["wellness", "education"],
  "typePair": {
    "display": "Fraunces, Georgia, serif",
    "body": "Nunito Sans, system-ui, sans-serif"
  },
  "typeScale": { "base": 17, "ratio": 1.25, "steps": [13, 15, 17, 21, 26, 33] },
  "radius": { "control": "24px", "panel": "48px" },
  "border": "1px solid",
  "shadow": "0 18px 50px rgba(138, 59, 18, 0.12)",
  "colorRecipe": {
    "background": "#FFFBF5",
    "surface": "#F5EBDD",
    "text": "#2A2118",
    "mutedText": "#5C4B3B",
    "accent": "#8A3B12",
    "accentText": "#FFFFFF",
    "border": "#C9B8A4",
    "focus": "#8A3B12",
    "contrastPairs": [
      {
        "foreground": "#2A2118",
        "background": "#FFFBF5",
        "ratio": 15.32,
        "usage": "text on background"
      },
      {
        "foreground": "#5C4B3B",
        "background": "#FFFBF5",
        "ratio": 8.07,
        "usage": "muted text on background"
      },
      {
        "foreground": "#2A2118",
        "background": "#F5EBDD",
        "ratio": 13.4,
        "usage": "text on surface"
      },
      {
        "foreground": "#5C4B3B",
        "background": "#F5EBDD",
        "ratio": 7.05,
        "usage": "muted text on surface"
      },
      {
        "foreground": "#FFFFFF",
        "background": "#8A3B12",
        "ratio": 7.73,
        "usage": "accent text on accent"
      },
      {
        "foreground": "#8A3B12",
        "background": "#FFFBF5",
        "ratio": 7.5,
        "usage": "accent text on background"
      },
      {
        "foreground": "#8A3B12",
        "background": "#FFFBF5",
        "ratio": 7.5,
        "usage": "focus ring on background"
      }
    ]
  },
  "density": 3,
  "motion": 3,
  "layoutRules": [
    "Vary section shapes while keeping one reading edge.",
    "Use curves as framing, not behind body copy.",
    "Keep the main column between 60 and 72 characters."
  ],
  "do": ["Pair warm neutrals with organic silhouettes.", "Keep buttons large and clearly labeled."],
  "dont": ["Turn every control into a pill.", "Overlap decorative shapes with text."],
  "a11yRisk": "Soft curves and low-contrast warm tones can make hierarchy and boundaries hard to perceive."
}
