{
  "slug": "executive-minimal",
  "name": "Executive Minimal",
  "surfaces": ["dashboard"],
  "description": "A few large KPIs with generous space and quiet detail.",
  "bestFor": ["founders", "board views"],
  "typePair": { "display": "Inter, system-ui, sans-serif", "body": "Inter, system-ui, sans-serif" },
  "typeScale": { "base": 16, "ratio": 1.25, "steps": [12, 14, 16, 20, 25, 31] },
  "radius": { "control": "6px", "panel": "10px" },
  "border": "1px solid",
  "shadow": "0 1px 2px rgba(17, 17, 17, 0.06)",
  "colorRecipe": {
    "background": "#FAFAFA",
    "surface": "#EEEEEE",
    "text": "#111111",
    "mutedText": "#4A4A4A",
    "accent": "#1F2937",
    "accentText": "#FFFFFF",
    "border": "#A3A3A3",
    "focus": "#111111",
    "contrastPairs": [
      {
        "foreground": "#111111",
        "background": "#FAFAFA",
        "ratio": 18.09,
        "usage": "text on background"
      },
      {
        "foreground": "#4A4A4A",
        "background": "#FAFAFA",
        "ratio": 8.49,
        "usage": "muted text on background"
      },
      {
        "foreground": "#111111",
        "background": "#EEEEEE",
        "ratio": 16.28,
        "usage": "text on surface"
      },
      {
        "foreground": "#4A4A4A",
        "background": "#EEEEEE",
        "ratio": 7.64,
        "usage": "muted text on surface"
      },
      {
        "foreground": "#FFFFFF",
        "background": "#1F2937",
        "ratio": 14.68,
        "usage": "accent text on accent"
      },
      {
        "foreground": "#1F2937",
        "background": "#FAFAFA",
        "ratio": 14.06,
        "usage": "accent text on background"
      },
      {
        "foreground": "#111111",
        "background": "#FAFAFA",
        "ratio": 18.09,
        "usage": "focus ring on background"
      }
    ]
  },
  "density": 3,
  "motion": 1,
  "layoutRules": [
    "Show no more than four KPIs above the fold.",
    "Use whitespace instead of extra dividers.",
    "Put supporting detail one action away."
  ],
  "do": ["Label every KPI with its period.", "Keep one clear drill-down path."],
  "dont": ["Hide all detail from the summary.", "Use pale gray for key numbers."],
  "a11yRisk": "Simplicity can remove the context people need, and quiet grays can drop below contrast minimums."
}
