{
  "slug": "soft-ui-neumorphism",
  "name": "Soft UI / Neumorphism",
  "surfaces": ["app"],
  "description": "Embossed, low-contrast surfaces with soft light and shadow.",
  "bestFor": ["single controls", "music players"],
  "typePair": {
    "display": "Quicksand, system-ui, sans-serif",
    "body": "Nunito Sans, system-ui, sans-serif"
  },
  "typeScale": { "base": 16, "ratio": 1.25, "steps": [12, 14, 16, 20, 25, 31] },
  "radius": { "control": "16px", "panel": "24px" },
  "border": "1px solid",
  "shadow": "inset 2px 2px 4px #d9c3bc, inset -2px -2px 4px #fff8f6",
  "colorRecipe": {
    "background": "#FFF4F2",
    "surface": "#FFE3DD",
    "text": "#3F1D18",
    "mutedText": "#6E463F",
    "accent": "#9A3412",
    "accentText": "#FFFFFF",
    "border": "#E3B8AC",
    "focus": "#9A3412",
    "contrastPairs": [
      {
        "foreground": "#3F1D18",
        "background": "#FFF4F2",
        "ratio": 13.91,
        "usage": "text on background"
      },
      {
        "foreground": "#6E463F",
        "background": "#FFF4F2",
        "ratio": 7.46,
        "usage": "muted text on background"
      },
      {
        "foreground": "#3F1D18",
        "background": "#FFE3DD",
        "ratio": 12.34,
        "usage": "text on surface"
      },
      {
        "foreground": "#6E463F",
        "background": "#FFE3DD",
        "ratio": 6.62,
        "usage": "muted text on surface"
      },
      {
        "foreground": "#FFFFFF",
        "background": "#9A3412",
        "ratio": 7.31,
        "usage": "accent text on accent"
      },
      {
        "foreground": "#9A3412",
        "background": "#FFF4F2",
        "ratio": 6.78,
        "usage": "accent text on background"
      },
      {
        "foreground": "#9A3412",
        "background": "#FFF4F2",
        "ratio": 6.78,
        "usage": "focus ring on background"
      }
    ]
  },
  "density": 4,
  "motion": 3,
  "layoutRules": [
    "Use embossing on isolated controls only.",
    "Keep form fields flat with a visible border.",
    "Reserve one raised surface per view."
  ],
  "do": ["Keep text contrast independent of shadows.", "Add a strong focus outline."],
  "dont": ["Use neumorphic styling for long forms.", "Use shadow as the only boundary cue."],
  "a11yRisk": "Soft shadows fail non-text contrast, so controls and states can become invisible to low-vision users."
}
